{
  "schema_version": "1.1",
  "name": "orbit.select_window",
  "executable": "mock-policy-select",
  "version": "0.1.0",
  "description": "1.1 policy capability sample",
  "commands": ["manifest", "validate", "run"],
  "capabilities": {
    "kind": "policy",
    "side_effect_class": "none",
    "relocatable": true,
    "deterministic": true,
    "idempotent": true,
    "retryable": true,
    "consumes": ["WindowSet"],
    "produces": ["TimeWindow"],
    "hardware_tag": null,
    "cost_hint": {
      "typical_latency_sec": 1
    }
  }
}
