{
  "schema_version": "1.1",
  "name": "net.deliver",
  "executable": "mock-net-deliver",
  "version": "0.1.0",
  "description": "1.1 deliver capability sample",
  "safety_class": "command_irreversible",
  "commands": ["manifest", "validate", "run"],
  "capabilities": {
    "kind": "deliver",
    "side_effect_class": "external_delivery",
    "relocatable": false,
    "deterministic": false,
    "idempotent": true,
    "retryable": false,
    "consumes": ["DataProduct", "Receiver"],
    "produces": ["DeliveryReceipt"],
    "hardware_tag": null,
    "compensation": null
  }
}
